1,Leanne Graham,et porro tempora,True
1,Leanne Graham,quo adipisci enim quam ut ab,True
1,Leanne Graham,illo est ratione doloremque quia maiores aut,True
1,Leanne Graham,vero rerum temporibus dolor,True
1,Leanne Graham,ipsa repellendus fugit nisi,True
1,Leanne Graham,repellendus sunt dolores architecto voluptatum,True
1,Leanne Graham,ab voluptatum amet voluptas,True
1,Leanne Graham,accusamus eos facilis sint et aut voluptatem,True
1,Leanne Graham,quo laboriosam deleniti aut qui,True
1,Leanne Graham,molestiae ipsa aut voluptatibus pariatur dolor nihil,True
1,Leanne Graham,ullam nobis libero sapiente ad optio sint,True
